<purchaseOrder orderDate="1999-05-20" complete="false"
	xmlns="urn:po"
	xmlns:xsi="http://www.w3.org/2001/XMLSchema-instance"
	xsi:schemaLocation="urn:po ../resources/po.xsd"
    
>
  <shipTo country="US">
    <name>Alice Smith</name>
    <street>123 Maple Street</street>
    <city>Mill Valley</city>
    <state>CA</state>
    <zip>90952</zip>
  </shipTo>
  <billTo country="US">
    <name>Robert Smith</name>
    <street>8 Oak Avenue</street>
    <city>Old Town</city>
    <state>PA</state>
    <zip>95819</zip>
  </billTo>
  <comment>Hurry, my lawn is going wild!</comment>
  <items>
    <item partNum="872-AA">
      <productName>Lawnmower</productName>
      <quantity>1</quantity>
      <USPrice>148.95</USPrice>
      <comment>Confirm this is electric</comment>
    </item>
    <item partNum="926-AA">
      <productName>Baby Monitor</productName>
      <quantity>1</quantity>
      <USPrice>39.98</USPrice>
      <shipDate>1999-10-21</shipDate>
    </item>
  </items>
  <payments>
    <payment paymentDate="1999-10-21">5.00</payment>
    <payment paymentDate="1999-10-22">10.00</payment>
    <payment paymentDate="1999-10-23">24.98</payment>
  </payments>
  <credits amount="5.00" reason="Promo: MAY99" />
  <credits amount="10.00" reason="Promo: OCT99" />
</purchaseOrder>
